case_id,case_name,case_type,filing_date,court_district,industry_sector,violation_type,status,defendant_name,defendant_type,resolution_date,_ingested_at
159,United States v. Maya Garcia,CRIMINAL,2018-09-30,DISTRICT_NJ,PHARMACEUTICALS,BID_RIGGING,CONVICTED,Maya Garcia,INDIVIDUAL,2020-08-31,2025-02-22T16:55:28
160,United States v. TechSystems LLC,CIVIL,2018-12-13,NORTHERN_CA,TECHNOLOGY,CONSPIRACY,OPEN,TechSystems LLC,CORPORATION,,2025-02-23T08:48:51
161,United States v. Grayson Rodriguez,CRIMINAL,2019-04-28,SOUTHERN_NY,CONSTRUCTION,TYING,CONVICTED,Grayson Rodriguez,INDIVIDUAL,2021-03-13,2025-02-24T11:32:24
162,United States v. HealthSystems Corp,CIVIL,2019-07-11,DISTRICT_DC,HEALTHCARE,EXCLUSIVE_DEALING,OPEN,HealthSystems Corp,CORPORATION,,2025-02-25T13:26:47
163,United States v. Brooklyn Martinez,CRIMINAL,2019-10-24,WESTERN_WA,TELECOMMUNICATIONS,MONOPOLIZATION,CONVICTED,Brooklyn Martinez,INDIVIDUAL,2021-09-16,2025-02-26T15:41:30
164,United States v. EnergySystems Inc.,CRIMINAL,2020-01-06,WESTERN_TX,ENERGY,MARKET_ALLOCATION,CONVICTED,EnergySystems Inc.,CORPORATION,2021-12-29,2025-02-27T10:15:53
165,United States v. Landon Thompson,CRIMINAL,2020-04-21,NORTHERN_IL,AGRICULTURE,PRICE_FIXING,CONVICTED,Landon Thompson,INDIVIDUAL,2022-04-14,2025-02-28T12:39:16
166,United States v. ManufacturingSystems LLC,CIVIL,2020-07-04,EASTERN_MI,MANUFACTURING,MERGER_CHALLENGE,OPEN,ManufacturingSystems LLC,CORPORATION,,2025-03-01T14:52:39
167,United States v. Skylar Davis,CRIMINAL,2020-10-17,SOUTHERN_GA,TRANSPORTATION,ATTEMPTED_MONOPOLIZATION,CONVICTED,Skylar Davis,INDIVIDUAL,2022-10-09,2025-03-02T16:47:22
168,United States v. PropertySystems Corp,CIVIL,2021-01-30,EASTERN_PA,REAL_ESTATE,BID_RIGGING,OPEN,PropertySystems Corp,CORPORATION,,2025-03-03T08:34:45
169,United States v. Jaxon Wilson,CRIMINAL,2021-05-15,CENTRAL_CA,RETAIL,CONSPIRACY,CONVICTED,Jaxon Wilson,INDIVIDUAL,2023-05-08,2025-03-04T11:58:38
170,United States v. DefenseSystems Inc.,CIVIL,2021-08-28,EASTERN_VA,DEFENSE,TYING,OPEN,DefenseSystems Inc.,CORPORATION,,2025-03-05T13:42:21
171,United States v. Layla Johnson,CRIMINAL,2021-11-10,DISTRICT_NJ,PHARMACEUTICALS,EXCLUSIVE_DEALING,CONVICTED,Layla Johnson,INDIVIDUAL,2023-11-02,2025-03-06T15:36:54
172,United States v. TechOperations LLC,CIVIL,2022-02-23,NORTHERN_CA,TECHNOLOGY,MONOPOLIZATION,OPEN,TechOperations LLC,CORPORATION,,2025-03-07T09:29:17
173,United States v. Connor Garcia,CRIMINAL,2022-06-08,SOUTHERN_NY,CONSTRUCTION,MARKET_ALLOCATION,CONVICTED,Connor Garcia,INDIVIDUAL,2024-06-01,2025-03-08T12:53:50
174,United States v. HealthOperations Corp,CIVIL,2022-09-21,DISTRICT_DC,HEALTHCARE,PRICE_FIXING,OPEN,HealthOperations Corp,CORPORATION,,2025-03-09T14:47:23
175,United States v. Addison Rodriguez,CRIMINAL,2022-12-04,WESTERN_WA,TELECOMMUNICATIONS,MERGER_CHALLENGE,CONVICTED,Addison Rodriguez,INDIVIDUAL,2024-11-26,2025-03-10T16:31:46
176,United States v. EnergyOperations Inc.,CRIMINAL,2023-03-19,WESTERN_TX,ENERGY,ATTEMPTED_MONOPOLIZATION,OPEN,EnergyOperations Inc.,CORPORATION,,2025-03-11T08:25:29
177,United States v. Nolan Martinez,CRIMINAL,2023-07-02,NORTHERN_IL,AGRICULTURE,BID_RIGGING,OPEN,Nolan Martinez,INDIVIDUAL,,2025-03-12T11:49:52
178,United States v. ManufacturingOperations LLC,CIVIL,2023-10-15,EASTERN_MI,MANUFACTURING,CONSPIRACY,OPEN,ManufacturingOperations LLC,CORPORATION,,2025-03-13T13:43:15
179,United States v. Nova Thompson,CRIMINAL,2024-01-28,SOUTHERN_GA,TRANSPORTATION,TYING,OPEN,Nova Thompson,INDIVIDUAL,,2025-03-14T15:27:38
180,United States v. PropertyOperations Corp,CIVIL,2024-05-13,EASTERN_PA,REAL_ESTATE,EXCLUSIVE_DEALING,OPEN,PropertyOperations Corp,CORPORATION,,2025-03-15T10:51:21
181,United States v. Easton Davis,CRIMINAL,2024-08-26,CENTRAL_CA,RETAIL,MONOPOLIZATION,OPEN,Easton Davis,INDIVIDUAL,,2025-03-16T12:44:54
182,United States v. DefenseOperations Inc.,CIVIL,2024-11-08,EASTERN_VA,DEFENSE,MARKET_ALLOCATION,OPEN,DefenseOperations Inc.,CORPORATION,,2025-03-17T14:38:17
183,United States v. Ellie Wilson,CRIMINAL,2025-01-21,DISTRICT_NJ,PHARMACEUTICALS,PRICE_FIXING,OPEN,Ellie Wilson,INDIVIDUAL,,2025-03-18T16:52:50
184,United States v. TechInnovations LLC,CIVIL,2010-05-12,NORTHERN_CA,TECHNOLOGY,MERGER_CHALLENGE,SETTLED,TechInnovations LLC,CORPORATION,2012-02-07,2025-01-19T08:36:23
185,United States v. Colton Johnson,CRIMINAL,2010-08-24,SOUTHERN_NY,CONSTRUCTION,ATTEMPTED_MONOPOLIZATION,CONVICTED,Colton Johnson,INDIVIDUAL,2012-05-17,2025-01-20T11:28:46
186,United States v. HealthInnovations Corp,CIVIL,2010-12-06,DISTRICT_DC,HEALTHCARE,BID_RIGGING,DISMISSED,HealthInnovations Corp,CORPORATION,2012-09-30,2025-01-21T13:52:29
187,United States v. Paisley Garcia,CRIMINAL,2011-03-21,WESTERN_WA,TELECOMMUNICATIONS,CONSPIRACY,CONVICTED,Paisley Garcia,INDIVIDUAL,2013-01-14,2025-01-22T15:46:12
188,United States v. EnergyInnovations Inc.,CRIMINAL,2011-07-04,WESTERN_TX,ENERGY,TYING,CONVICTED,EnergyInnovations Inc.,CORPORATION,2013-04-28,2025-01-23T10:39:55
189,United States v. Brayden Rodriguez,CRIMINAL,2011-10-17,NORTHERN_IL,AGRICULTURE,EXCLUSIVE_DEALING,CONVICTED,Brayden Rodriguez,INDIVIDUAL,2013-08-11,2025-01-24T12:33:38
190,United States v. ManufacturingInnovations LLC,CIVIL,2012-01-30,EASTERN_MI,MANUFACTURING,MONOPOLIZATION,SETTLED,ManufacturingInnovations LLC,CORPORATION,2013-11-24,2025-01-25T14:58:21
191,United States v. Kennedy Martinez,CRIMINAL,2012-05-14,SOUTHERN_GA,TRANSPORTATION,MARKET_ALLOCATION,CONVICTED,Kennedy Martinez,INDIVIDUAL,2014-03-09,2025-01-26T16:42:44
192,United States v. PropertyInnovations Corp,CIVIL,2012-08-27,EASTERN_PA,REAL_ESTATE,PRICE_FIXING,DISMISSED,PropertyInnovations Corp,CORPORATION,2014-06-22,2025-01-27T08:27:17
193,United States v. Blake Thompson,CRIMINAL,2012-11-09,CENTRAL_CA,RETAIL,MERGER_CHALLENGE,CONVICTED,Blake Thompson,INDIVIDUAL,2014-10-05,2025-01-28T11:51:50
194,United States v. DefenseInnovations Inc.,CIVIL,2013-02-22,EASTERN_VA,DEFENSE,ATTEMPTED_MONOPOLIZATION,SETTLED,DefenseInnovations Inc.,CORPORATION,2015-01-17,2025-01-29T13:45:23
195,United States v. Ryleigh Davis,CRIMINAL,2013-06-07,DISTRICT_NJ,PHARMACEUTICALS,BID_RIGGING,CONVICTED,Ryleigh Davis,INDIVIDUAL,2015-05-02,2025-01-30T15:38:46
196,United States v. TechStrategies LLC,CIVIL,2013-09-20,NORTHERN_CA,TECHNOLOGY,CONSPIRACY,SETTLED,TechStrategies LLC,CORPORATION,2015-08-15,2025-01-31T09:32:29
197,United States v. Declan Wilson,CRIMINAL,2013-12-03,SOUTHERN_NY,CONSTRUCTION,TYING,CONVICTED,Declan Wilson,INDIVIDUAL,2015-11-28,2025-02-01T12:56:52
198,United States v. HealthStrategies Corp,CIVIL,2014-04-18,DISTRICT_DC,HEALTHCARE,EXCLUSIVE_DEALING,DISMISSED,HealthStrategies Corp,CORPORATION,2016-03-12,2025-02-02T14:49:35
199,United States v. Emery Johnson,CRIMINAL,2014-07-31,WESTERN_WA,TELECOMMUNICATIONS,MONOPOLIZATION,CONVICTED,Emery Johnson,INDIVIDUAL,2016-06-25,2025-02-03T16:34:18
200,United States v. EnergyStrategies Inc.,CRIMINAL,2014-11-13,WESTERN_TX,ENERGY,MARKET_ALLOCATION,CONVICTED,EnergyStrategies Inc.,CORPORATION,2016-10-08,2025-02-04T08:28:51